{"accounting":{"canonical_rows":"2666","conflicting_duplicates":"0","controls":"17718","duplicate_sightings":"0","intentional_exclusions":"141","manifest_committed_rows":"2666","native_rows":"2807","quarantined_rows":"0","received_messages":"19312","rejected_rows":"0","synced_rows":"2666","trade_bearing_messages":"1594","writer_accepted_rows":"2666"},"aggregate_constituents":null,"coverage":[{"evidence":[{"bytes":"302","path":"objects/de0258fe649a8904e3ff72d187cdc5fda001b3cc2dfb07a5bd94a42272ee07be","sha256":"de0258fe649a8904e3ff72d187cdc5fda001b3cc2dfb07a5bd94a42272ee07be"}],"interval":{"boundary":"[start,end)","end_utc":"2026-10-19T20:36:48.887283Z","start_utc":"2026-10-19T20:21:31.680973Z"},"reason_codes":["native-continuity-not-proven"],"state":"unknown-continuity","stream_identity":"hyperliquid:21:@107"},{"evidence":[{"bytes":"302","path":"objects/de0258fe649a8904e3ff72d187cdc5fda001b3cc2dfb07a5bd94a42272ee07be","sha256":"de0258fe649a8904e3ff72d187cdc5fda001b3cc2dfb07a5bd94a42272ee07be"}],"interval":{"boundary":"[start,end)","end_utc":"2026-10-19T20:36:48.887283Z","start_utc":"2026-10-19T20:21:31.680973Z"},"reason_codes":["native-continuity-not-proven"],"state":"unknown-continuity","stream_identity":"hyperliquid:21:PURR/USDC"},{"evidence":[{"bytes":"302","path":"objects/de0258fe649a8904e3ff72d187cdc5fda001b3cc2dfb07a5bd94a42272ee07be","sha256":"de0258fe649a8904e3ff72d187cdc5fda001b3cc2dfb07a5bd94a42272ee07be"}],"interval":{"boundary":"[start,end)","end_utc":"2026-10-19T20:36:48.887283Z","start_utc":"2026-10-19T20:21:31.680973Z"},"reason_codes":["native-continuity-not-proven"],"state":"unknown-continuity","stream_identity":"hyperliquid:22:BTC"},{"evidence":[{"bytes":"302","path":"objects/de0258fe649a8904e3ff72d187cdc5fda001b3cc2dfb07a5bd94a42272ee07be","sha256":"de0258fe649a8904e3ff72d187cdc5fda001b3cc2dfb07a5bd94a42272ee07be"}],"interval":{"boundary":"[start,end)","end_utc":"2026-10-19T20:36:48.887283Z","start_utc":"2026-10-19T20:21:31.680973Z"},"reason_codes":["native-continuity-not-proven"],"state":"unknown-continuity","stream_identity":"hyperliquid:22:ETH"},{"evidence":[{"bytes":"302","path":"objects/de0258fe649a8904e3ff72d187cdc5fda001b3cc2dfb07a5bd94a42272ee07be","sha256":"de0258fe649a8904e3ff72d187cdc5fda001b3cc2dfb07a5bd94a42272ee07be"}],"interval":{"boundary":"[start,end)","end_utc":"2026-10-19T20:36:48.887283Z","start_utc":"2026-10-19T20:21:31.680973Z"},"reason_codes":["native-continuity-not-proven"],"state":"unknown-continuity","stream_identity":"hyperliquid:22:xyz:TSLA"}],"dataset_id":"hyperliquid-shared-soak-08","objects":[{"event_time_bounds_ns":[null,null],"kind":"mfr1","metadata_parents":[{"bytes":"2363","path":"objects/ca3c29389ccec0f3e4a178496224a72d16529961fb717905dca97c739dc0a3b2","sha256":"ca3c29389ccec0f3e4a178496224a72d16529961fb717905dca97c739dc0a3b2"},{"bytes":"4494","path":"objects/aa8ee1da8a89982db6781145bac8a81c11e30279b3103605604ffcb22a31f646","sha256":"aa8ee1da8a89982db6781145bac8a81c11e30279b3103605604ffcb22a31f646"}],"object":{"bytes":"2037477","path":"objects/a2ab21037599ce4dbcd8798ffe19029ba780da7e3c2295a754544434e7265ae6","sha256":"a2ab21037599ce4dbcd8798ffe19029ba780da7e3c2295a754544434e7265ae6"},"raw_parents":[],"rows":"6300","semantic_sha256":null},{"event_time_bounds_ns":[null,null],"kind":"mfr1","metadata_parents":[{"bytes":"2363","path":"objects/ca3c29389ccec0f3e4a178496224a72d16529961fb717905dca97c739dc0a3b2","sha256":"ca3c29389ccec0f3e4a178496224a72d16529961fb717905dca97c739dc0a3b2"},{"bytes":"4494","path":"objects/aa8ee1da8a89982db6781145bac8a81c11e30279b3103605604ffcb22a31f646","sha256":"aa8ee1da8a89982db6781145bac8a81c11e30279b3103605604ffcb22a31f646"}],"object":{"bytes":"2074538","path":"objects/734440b5380716a2a68023468e029323eff25d5faeedc594d19987d168e0cc27","sha256":"734440b5380716a2a68023468e029323eff25d5faeedc594d19987d168e0cc27"},"raw_parents":[],"rows":"6500","semantic_sha256":null},{"event_time_bounds_ns":[null,null],"kind":"mfr1","metadata_parents":[{"bytes":"2363","path":"objects/ca3c29389ccec0f3e4a178496224a72d16529961fb717905dca97c739dc0a3b2","sha256":"ca3c29389ccec0f3e4a178496224a72d16529961fb717905dca97c739dc0a3b2"},{"bytes":"4494","path":"objects/aa8ee1da8a89982db6781145bac8a81c11e30279b3103605604ffcb22a31f646","sha256":"aa8ee1da8a89982db6781145bac8a81c11e30279b3103605604ffcb22a31f646"}],"object":{"bytes":"2076893","path":"objects/17becca33a5f67f4701281cd55bee9830eb1121145654c59d115a344cdbbca9e","sha256":"17becca33a5f67f4701281cd55bee9830eb1121145654c59d115a344cdbbca9e"},"raw_parents":[],"rows":"6634","semantic_sha256":null},{"event_time_bounds_ns":["1792441291923000000","1792442191050000000"],"kind":"canonical-parquet","metadata_parents":[{"bytes":"2363","path":"objects/ca3c29389ccec0f3e4a178496224a72d16529961fb717905dca97c739dc0a3b2","sha256":"ca3c29389ccec0f3e4a178496224a72d16529961fb717905dca97c739dc0a3b2"},{"bytes":"4494","path":"objects/aa8ee1da8a89982db6781145bac8a81c11e30279b3103605604ffcb22a31f646","sha256":"aa8ee1da8a89982db6781145bac8a81c11e30279b3103605604ffcb22a31f646"}],"object":{"bytes":"215999","path":"objects/7a71ca170e19e52c3299c3793962e4d684eafae77802846617d6b77f4bca69cb","sha256":"7a71ca170e19e52c3299c3793962e4d684eafae77802846617d6b77f4bca69cb"},"raw_parents":[{"bytes":"2037477","path":"objects/a2ab21037599ce4dbcd8798ffe19029ba780da7e3c2295a754544434e7265ae6","sha256":"a2ab21037599ce4dbcd8798ffe19029ba780da7e3c2295a754544434e7265ae6"},{"bytes":"2074538","path":"objects/734440b5380716a2a68023468e029323eff25d5faeedc594d19987d168e0cc27","sha256":"734440b5380716a2a68023468e029323eff25d5faeedc594d19987d168e0cc27"},{"bytes":"2076893","path":"objects/17becca33a5f67f4701281cd55bee9830eb1121145654c59d115a344cdbbca9e","sha256":"17becca33a5f67f4701281cd55bee9830eb1121145654c59d115a344cdbbca9e"}],"rows":"2666","semantic_sha256":"5954e9bc9dd75e5592424e19539589d632fdb3fb468b4af0456d240305f137c2"},{"event_time_bounds_ns":[null,null],"kind":"sidecar","metadata_parents":[{"bytes":"2363","path":"objects/ca3c29389ccec0f3e4a178496224a72d16529961fb717905dca97c739dc0a3b2","sha256":"ca3c29389ccec0f3e4a178496224a72d16529961fb717905dca97c739dc0a3b2"},{"bytes":"4494","path":"objects/aa8ee1da8a89982db6781145bac8a81c11e30279b3103605604ffcb22a31f646","sha256":"aa8ee1da8a89982db6781145bac8a81c11e30279b3103605604ffcb22a31f646"},{"bytes":"185095","path":"objects/e90ceeda6002410505fd02c63de62ab4db884601c70fb8338c7dd2209ce8e3a3","sha256":"e90ceeda6002410505fd02c63de62ab4db884601c70fb8338c7dd2209ce8e3a3"},{"bytes":"185095","path":"objects/a1750f6badb47b73a4b3f71baef227b495493726627be5c7697566bdfb8922af","sha256":"a1750f6badb47b73a4b3f71baef227b495493726627be5c7697566bdfb8922af"},{"bytes":"113906","path":"objects/d89bdf90cd4fc7b2549ef54b0eb7872a15a065b6da091cda3f9323fa36470dd1","sha256":"d89bdf90cd4fc7b2549ef54b0eb7872a15a065b6da091cda3f9323fa36470dd1"}],"object":{"bytes":"536753","path":"objects/c7afa5b5e0b5ad9406bbf83f0df634d31df9e06cdebfce10a2e1b2c7a2f7ae98","sha256":"c7afa5b5e0b5ad9406bbf83f0df634d31df9e06cdebfce10a2e1b2c7a2f7ae98"},"raw_parents":[{"bytes":"29736358","path":"objects/14a434f93ea22ea2c4e02efdeeb8ac26f6f8a1be53a52d1706575d69375297d0","sha256":"14a434f93ea22ea2c4e02efdeeb8ac26f6f8a1be53a52d1706575d69375297d0"}],"rows":"2807","semantic_sha256":null}],"observed":{"availability_time_bounds_ns":[null,null],"event_time_bounds_ns":["1792441291923000000","1792442191050000000"],"instruments":["hyperliquid:21:@107","hyperliquid:21:PURR/USDC","hyperliquid:22:BTC","hyperliquid:22:ETH","hyperliquid:22:xyz:TSLA"],"receipt_time_bounds_ns":["1792441294580144000","1792442191504834000"]},"parent_manifest_sha256":null,"provenance":{"acquisitions":[{"api_product":"spot","capture_or_retrieval_utc":"2026-10-19T20:21:33.81432Z","channel":"trades","context_id":"6ef1bf25572caa570faf27d3035e75414485faaa:session:1","cursor_checkpoint":{"bytes":"89","path":"objects/46b0c0cdcebfffa8f923411d6f131677e4d8dfe8f5b97000a3957654f5e79634","sha256":"46b0c0cdcebfffa8f923411d6f131677e4d8dfe8f5b97000a3957654f5e79634"},"endpoint":"wss://api.hyperliquid.xyz/ws","live_backfill_boundaries":[],"mode":"live","region":"unknown","venue":"hyperliquid-21"},{"api_product":"linear-perpetuals","capture_or_retrieval_utc":"2026-10-19T20:21:34.361341Z","channel":"trades","context_id":"6ef1bf25572caa570faf27d3035e75414485faaa:session:2","cursor_checkpoint":{"bytes":"89","path":"objects/46b0c0cdcebfffa8f923411d6f131677e4d8dfe8f5b97000a3957654f5e79634","sha256":"46b0c0cdcebfffa8f923411d6f131677e4d8dfe8f5b97000a3957654f5e79634"},"endpoint":"wss://api.hyperliquid.xyz/ws","live_backfill_boundaries":[],"mode":"live","region":"unknown","venue":"hyperliquid-22"}],"build":{"bytes":"181","path":"objects/5322f4160398eec5b87b4ca47871c6479d39936eab2a0e1521ef5bbc55e44b34","sha256":"5322f4160398eec5b87b4ca47871c6479d39936eab2a0e1521ef5bbc55e44b34"},"configuration":{"bytes":"842","path":"objects/db5270bd11da75c0831db3674156472098a265383d6c4fa6d99a4a3445d5dc10","sha256":"db5270bd11da75c0831db3674156472098a265383d6c4fa6d99a4a3445d5dc10"},"decoder":{"bytes":"9745","path":"objects/18f4bdbf021315a84e9654bb97492f4de6903718afbd34aad119090e282fc757","sha256":"18f4bdbf021315a84e9654bb97492f4de6903718afbd34aad119090e282fc757"},"features":["unknown"],"instrument_metadata":[{"bytes":"2363","path":"objects/ca3c29389ccec0f3e4a178496224a72d16529961fb717905dca97c739dc0a3b2","sha256":"ca3c29389ccec0f3e4a178496224a72d16529961fb717905dca97c739dc0a3b2"},{"bytes":"4494","path":"objects/aa8ee1da8a89982db6781145bac8a81c11e30279b3103605604ffcb22a31f646","sha256":"aa8ee1da8a89982db6781145bac8a81c11e30279b3103605604ffcb22a31f646"}],"lockfile":{"bytes":"73199","path":"objects/11ce39dbf9870dea131be3abb5987e422516b3fe94240026f694d3b4b6b0be75","sha256":"11ce39dbf9870dea131be3abb5987e422516b3fe94240026f694d3b4b6b0be75"},"schema":{"bytes":"5276","path":"objects/448ab9488ebd42f71996c307d33e4258ad01aacfc6390e207be625f3c959686e","sha256":"448ab9488ebd42f71996c307d33e4258ad01aacfc6390e207be625f3c959686e"},"source_commit":"62a8fef3ed17b23ad968eb4f0d8